{
  "$schema": "../../schemas/artifact-record.schema.json",
  "run_id": "example.ru.science-article:1",
  "artifact_revision": "artifact-2",
  "parent_revision": "artifact-1",
  "stage": "edit",
  "publication": {
    "content_type": "article",
    "text": "# Почему ограничения исследования должны оставаться рядом с результатом\n\nФраза «исследование показало» почти ничего не говорит сама по себе. Смысл результата зависит от того, что изучали, каким методом, на какой выборке или материале и в каком статусе опубликована работа. Поэтому доказательные границы лучше ставить рядом с выводом, а не убирать в примечание, до которого читатель может не добраться.\n\nВ правилах этого репозитория научное утверждение связывается как минимум со статусом публикации, объектом исследования, методом, измеренным результатом и ограничениями. Такая запись не превращает источник в истину, но помогает заметить расширение вывода. Результат для лабораторной модели нельзя без дополнительного основания переносить на людей, а наблюдаемую связь — называть причиной.\n\nДо начала черновика эти сведения можно собрать в компактную карточку исследования. Она показывает, какие элементы подтверждены источником, какие требуют атрибуции, а какие остаются неизвестными. Это проектная логика, а не измеренный эффект: выбранные материалы не доказывают, что карточка уже снизила число ошибок в конкретной редакции.\n\nДля практической проверки сопоставьте каждый существенный вывод с источником, обозначьте его масштаб и поставьте оговорку там, где читатель встречает утверждение. Если без названия исследования фраза начинает обещать больше, чем измеряли авторы, доказательная граница потеряна.\n\nХорошее объяснение не прячет неопределённость. Оно показывает результат вместе с условиями, при которых этот результат имеет смысл.",
    "metadata": {
      "title": "Почему ограничения исследования должны оставаться рядом с результатом",
      "description": "Практический способ сохранить доказательные границы научного утверждения при подготовке статьи."
    }
  },
  "visuals": [
    {
      "asset": "asset://example.ru.science-article/evidence-boundary-v1",
      "purpose": "Показать путь от исследовательского объекта к ограниченному утверждению.",
      "caption": "Концептуальная схема: статус, объект, метод, результат и ограничения определяют допустимую формулировку.",
      "alt_text": "Пять блоков — статус публикации, объект, метод, результат и ограничения — сходятся в блок «ограниченное утверждение».",
      "provenance": "Концептуальная редакционная схема по SRC-001 и SRC-002; не изображает реальное исследование."
    }
  ],
  "claim_usage": [
    {
      "claim_id": "C-001",
      "locations": [
        "paragraph-2"
      ]
    },
    {
      "claim_id": "C-002",
      "locations": [
        "paragraph-3"
      ]
    }
  ],
  "adapter": {
    "id": "fixture.editorial-editor",
    "mode": "human",
    "version": "1"
  },
  "addressed_findings": []
}
