{
  "$schema": "../../schemas/artifact-record.schema.json",
  "run_id": "example.ru.science-article:1",
  "artifact_revision": "artifact-1",
  "stage": "draft",
  "publication": {
    "content_type": "article",
    "text": "# Почему ограничения исследования должны оставаться рядом с результатом\n\nФраза «исследование показало» почти ничего не говорит сама по себе. Значение результата зависит от того, что именно изучали, каким методом, на какой выборке или материале и в каком статусе опубликована работа. Поэтому научная статья должна сохранять эти границы рядом с выводом, а не отправлять их в примечание, до которого читатель может не добраться.\n\nВ правилах этого репозитория научное утверждение связывается как минимум со статусом публикации, объектом исследования, методом, измеренным результатом и ограничениями. Такая запись не превращает источник в истину, но не даёт незаметно расширить его вывод. Результат для лабораторной модели нельзя без дополнительного основания переносить на людей, а наблюдаемую связь — называть причиной.\n\nПеред черновиком эти сведения удобно собрать в компактную карточку исследования. Она показывает редактору, какие элементы подтверждены источником, какие требуют атрибуции, а какие остаются неизвестными. Это проектное решение: текущие материалы объясняют его логику, но не доказывают, что оно уже снизило число ошибок в конкретной редакции.\n\nПрактическая проверка проста. Для каждого существенного вывода нужно найти источник, обозначить его масштаб и поставить оговорку там, где читатель встречает утверждение. Если после удаления названия исследования фраза начинает обещать больше, чем измеряли авторы, граница потеряна.\n\nХорошее объяснение не прячет неопределённость. Оно помогает увидеть результат вместе с условиями, при которых этот результат имеет смысл.",
    "metadata": {
      "title": "Почему ограничения исследования должны оставаться рядом с результатом",
      "description": "Практический способ сохранить доказательные границы научного утверждения при подготовке статьи."
    }
  },
  "visuals": [],
  "claim_usage": [
    {
      "claim_id": "C-001",
      "locations": [
        "paragraph-2"
      ]
    },
    {
      "claim_id": "C-002",
      "locations": [
        "paragraph-3"
      ]
    }
  ],
  "adapter": {
    "id": "fixture.editorial-drafter",
    "mode": "model",
    "version": "1"
  },
  "addressed_findings": []
}
