{
  "$schema": "../../../../schemas/artifact-record.schema.json",
  "run_id": "pilot.ru.mysticism-article:1",
  "artifact_revision": "mysticism-edit-1",
  "parent_revision": "mysticism-draft-1",
  "stage": "edit",
  "publication": {
    "content_type": "article",
    "text": "# Тень за дверью: как недосказанность работает в мистических историях\n\nПредставим условную сцену: в пустом коридоре горит одна лампа, а на полу появляется мокрый след. История может сразу назвать причину, показать чудовище или перечислить правила древнего проклятия. Но может поступить иначе — оставить причину открытой, а след сделать бесспорным внутри вымышленного мира.\n\nВ зазоре между видимым последствием и неизвестной причиной и появляется мистика. Не как доказательство сверхъестественного, а как устройство повествования, в котором привычного объяснения пока недостаточно.\n\n## Мистика начинается не с монстра\n\nПоказанная опасность быстро превращается в конкретную задачу. У неё появляется форма, набор возможностей и, возможно, способ защиты. Неизвестность оставляет рядом несколько версий: бытовую, случайную, человеческую и сверхъестественную.\n\nНо одного отсутствия ответа мало. Если история только прячет информацию и не задаёт границ, неизвестность перестаёт быть напряжением. Она становится обещанием, которое позднее можно выполнить чем угодно.\n\nРаботающая недосказанность ограничена. В условном сюжете дверь открывается только ночью, шаги слышны на одном пролёте, а письмо появляется после определённого выбора. Это не формула жанра, а демонстрация принципа: причина скрыта, но её проявления не случайны.\n\n## Тайне нужны правила\n\nПравило не обязательно произносить вслух. Оно может обнаруживаться через повторение, последовательность или цену ошибки. Важно, чтобы новое событие не отменяло предыдущие только ради очередного эффекта.\n\nОграничения создают пространство для интерпретации. Одна версия объясняет часть признаков, другая — другую, но ни одна не закрывает вопрос полностью. История очерчивает тёмную комнату по краям: содержимое не видно, зато понятны её размеры.\n\nЗдесь проходит граница между недосказанностью и произволом. Тайна допускает несколько объяснений. Произвол не даёт оснований выбрать даже между ними.\n\n## След важнее дополнительной справки\n\nМистический эпизод обретает вес, когда оставляет конкретное последствие: сдвинутый предмет, повторившуюся фразу, изменившийся маршрут или пустое место на фотографии. Это примеры деталей внутри условных историй, а не сообщения о реальных событиях.\n\nТакой след не доказывает сверхъестественную причину — и именно поэтому сохраняет двойственность. Нечто произошло, но объяснение остаётся открытым. Тайна влияет на решения и направление действия, а не висит отдельным облаком атмосферы.\n\nПо выбранному здесь критерию последствие полезнее ещё одного объясняющего абзаца, если оно сужает пространство версий, но не сводит его к инструкции.\n\n## Когда тайна превращается в туман\n\nНедосказанность распадается, когда любое противоречие можно оправдать словами «это мистика». У события нет устойчивой формы, цены и связи с принятыми решениями. Текст откладывает ответ, но ничего не строит вместо него.\n\nПроблема не в отсутствии разгадки, а в отсутствии предмета для разгадки. Если признаки не складываются хотя бы в несколько конкурирующих версий, остаётся не интерпретировать, а ждать авторского объявления.\n\nЕсть практическая проверка: можно ли до финала сформулировать две-три версии и назвать деталь, которая поддерживает или ослабляет каждую? Если нельзя, возможно, история скрывает не ответ, а пустоту.\n\n## Не всякой тайне нужен полный ответ\n\nРазвязка может назвать причину и сохранить мистическое качество. Вопрос не в запрете на объяснения, а в том, что объяснение делает с уже созданным пространством смыслов.\n\nЕсли финал связывает детали, показывает цену событий и открывает новый угол, он завершает историю. Если выдаёт справку о происхождении каждого странного звука, тайна рискует уменьшиться до перечня механических причин.\n\nЭто редакционный критерий, а не обязательный закон жанра. Одним историям нужна точная разгадка. Другим полезнее оставить часть двери закрытой. Решение зависит от обещания текста: решить загадку, пережить неопределённость или увидеть, как разные версии меняют смысл одного события.\n\n## Что остаётся в темноте\n\nСильная мистическая недосказанность — не пустое место вместо ответа, а организованное пространство неизвестного. У него есть границы, повторяющиеся признаки и последствия. Оно допускает несколько версий, но не любую версию.\n\nПоэтому к мистической истории стоит задать не только вопрос «что там было?». Важнее другой: «Что изменилось из-за того, что ответ остался неизвестным?» Если неопределённость влияет на выбор, усиливает тему или сталкивает правдоподобные версии, она участвует в истории. Если не меняется ничего, перед нами, вероятно, просто закрытая дверь.\n\nИногда её стоит открыть. Иногда достаточно увидеть полоску света под порогом.",
    "metadata": {
      "title": "Тень за дверью: как недосказанность работает в мистических историях",
      "description": "Почему мистической тайне нужны правила, конкретные последствия и пространство для нескольких объяснений."
    }
  },
  "visuals": [],
  "claim_usage": [
    {
      "claim_id": "C-001",
      "locations": [
        "Мистика начинается не с монстра",
        "Тайне нужны правила",
        "Когда тайна превращается в туман",
        "Что остаётся в темноте"
      ]
    },
    {
      "claim_id": "C-002",
      "locations": [
        "opening",
        "След важнее дополнительной справки"
      ]
    },
    {
      "claim_id": "C-003",
      "locations": [
        "Не всякой тайне нужен полный ответ",
        "Что остаётся в темноте"
      ]
    }
  ],
  "adapter": {
    "id": "codex.pilot-editorial",
    "mode": "model",
    "version": "1"
  },
  "addressed_findings": []
}
