{
  "$schema": "../../../../schemas/artifact-record.schema.json",
  "run_id": "pilot.ru.mysticism-article:1",
  "artifact_revision": "mysticism-draft-1",
  "stage": "draft",
  "publication": {
    "content_type": "article",
    "text": "# Тень за дверью: как недосказанность работает в мистических историях\n\nПредставим условную сцену: в пустом коридоре горит одна лампа, а на полу появляется мокрый след. История может сразу объяснить, откуда он взялся. Может показать чудовище. Может назвать древнее проклятие и перечислить его правила. Но есть и другой ход: оставить причину открытой, а след — настоящим внутри мира истории.\n\nИменно в этом зазоре между видимым последствием и неизвестной причиной появляется мистика. Не как доказательство сверхъестественного, а как способ построить повествование, в котором привычного объяснения пока недостаточно.\n\n## Мистика начинается не с монстра\n\nПрямо показанная опасность быстро становится конкретной задачей. У неё появляется форма, набор возможностей и, возможно, способ защиты. Неизвестность устроена иначе. Она позволяет одновременно удерживать несколько версий: бытовую, случайную, человеческую и сверхъестественную.\n\nОднако простого отсутствия ответа мало. Если история только прячет информацию, не устанавливая никаких границ, неизвестность перестаёт быть напряжением и превращается в обещание, которое можно выполнить чем угодно.\n\nРаботающая недосказанность ограничена. Дверь открывается только ночью. Шаги слышны на одном пролёте. Письмо появляется после определённого выбора. Это условные примеры, а не формула жанра. Их задача — показать принцип: причина остаётся неизвестной, но её проявления не случайны.\n\n## Тайне нужны правила\n\nПравило не обязано быть произнесено вслух. Оно может проявляться через повторение, последовательность или цену ошибки. Важно, чтобы новое событие не отменяло предыдущие без причины.\n\nТакие ограничения создают пространство для интерпретации. Одна версия объясняет часть признаков, другая — другую часть, но ни одна не закрывает вопрос полностью. История как будто очерчивает тёмную комнату по краям: мы не видим, что внутри, зато понимаем её размеры.\n\nЗдесь проходит граница между недосказанностью и произволом. Тайна допускает несколько объяснений. Произвол не даёт оснований выбрать хотя бы между ними.\n\n## След иногда важнее причины\n\nМистический эпизод становится ощутимее, когда оставляет конкретное последствие. Не обязательно громкое. Сдвинутый предмет, повторившаяся фраза, изменившийся маршрут, пустое место в семейной фотографии — всё это может быть следом внутри вымышленной истории.\n\nСлед важен не потому, что доказывает сверхъестественное. Напротив, он сохраняет двойственность. Произошло нечто, что требует внимания, но причина всё ещё открыта. За счёт этого повествование получает опору: тайна влияет на решения, отношения или направление действия, а не существует отдельным облаком атмосферы.\n\nПо выбранному для этой статьи критерию последствие полезнее ещё одного объясняющего абзаца, если оно сужает пространство версий, но не сводит его к одной инструкции.\n\n## Когда тайна превращается в туман\n\nНедосказанность перестаёт работать, когда любое противоречие можно оправдать словами «это мистика». Тогда у события нет ни устойчивой формы, ни цены, ни связи с решениями героев. История откладывает ответ, но ничего не строит вместо него.\n\nПроблема здесь не в отсутствии разгадки. Проблема в отсутствии предмета для разгадки. Если признаки не складываются хотя бы в несколько конкурирующих версий, аудитории остаётся не интерпретировать, а ждать авторского объявления.\n\nПолезная проверка проста: можно ли до финала сформулировать две-три версии и назвать деталь, которая поддерживает или ослабляет каждую? Если нельзя, возможно, текст скрывает не ответ, а пустоту.\n\n## Не всякой тайне нужен полный ответ\n\nРазвязка может назвать причину и всё равно сохранить мистическое качество. Вопрос не в том, запрещено ли объяснять, а в том, что объяснение делает с уже созданным пространством смыслов.\n\nЕсли финал связывает детали, показывает цену событий и открывает новый угол, он завершает историю. Если он просто выдаёт справку о происхождении каждого странного звука, тайна может уменьшиться до перечня механических причин.\n\nЭто редакционный критерий, а не обязательный закон жанра. Есть истории, которым нужна точная разгадка. Есть истории, где важнее оставить часть двери закрытой. Решение зависит от того, какое обещание текст дал читателю: решить загадку, пережить неопределённость или увидеть, как разные объяснения меняют смысл одного события.\n\n## Что остаётся в темноте\n\nСильная мистическая недосказанность — не пустое место вместо ответа. Это организованное пространство неизвестного. У него есть границы, повторяющиеся признаки и последствия. Оно допускает несколько версий, но не любую версию.\n\nПоэтому полезный вопрос к мистической истории звучит не только как «что там было?». Стоит спросить: «Что именно изменилось из-за того, что мы не знаем ответа?» Если неизвестность меняет выбор, усиливает тему или сталкивает правдоподобные версии, она участвует в истории. Если ничего не меняется, перед нами, вероятно, просто закрытая дверь.\n\nИногда её стоит открыть. Иногда — достаточно увидеть полоску света под порогом.",
    "metadata": {
      "title": "Тень за дверью: как недосказанность работает в мистических историях",
      "description": "Почему мистической тайне нужны правила, конкретные последствия и пространство для нескольких объяснений."
    }
  },
  "visuals": [],
  "claim_usage": [
    {
      "claim_id": "C-001",
      "locations": [
        "Мистика начинается не с монстра",
        "Тайне нужны правила",
        "Когда тайна превращается в туман",
        "Что остаётся в темноте"
      ]
    },
    {
      "claim_id": "C-002",
      "locations": [
        "opening",
        "След иногда важнее причины"
      ]
    },
    {
      "claim_id": "C-003",
      "locations": [
        "Не всякой тайне нужен полный ответ",
        "Что остаётся в темноте"
      ]
    }
  ],
  "adapter": {
    "id": "codex.pilot-editorial",
    "mode": "model",
    "version": "1"
  },
  "addressed_findings": []
}
